{
  "schema": "senior-pomidor.review-report.v1",
  "title": "setup-python dependency update review",
  "case_id": "RV-02",
  "reviewer_version": "1.0",
  "reviewer_hash": "51ab66ce62e2b5363d7a71587edb937f1e34feb842d726e24141da4b03c38f0f",
  "verdict": "APPROVE",
  "rationale": "The complete pinned diff changes only actions/setup-python from v6 to v7 in CI and release workflows while preserving the supported Python version and existing cache settings.",
  "classification": {
    "task_classes": ["infrastructure_deployment"],
    "risk_flags": [],
    "sp_fail_ids": []
  },
  "scope_architecture": "The workflow-only change remains within CI/release automation and does not alter application runtime, contracts, storage, deployment topology, or hardware behavior.",
  "findings": [],
  "contract_consumer_review": "The four affected workflow steps retain python-version 3.12; the cache configuration remains present in the three steps that previously used it. There are no runtime consumers or public contracts changed by this diff.",
  "evidence_matrix": [
    {"check": "Pinned diff SHA-256", "status": "PASS", "manual": false},
    {"check": "Workflow Python-version and cache configuration inspection", "status": "PASS", "manual": false},
    {"check": "Historical CI workflow validation supplied by implementation report", "status": "PASS", "manual": false}
  ],
  "operations_safety_security_privacy": "No production service, secret, data path, external export, or physical capability is changed.",
  "documentation_assessment": "No documentation change is required for this scoped workflow action-version update.",
  "follow_ups": [],
  "limitations": ["The historical fixture provides a PASS summary rather than retained job logs; no high-risk or manual evidence is selected by the reclassification."]
}
