{
  "schema": "senior-pomidor.review-report.v1",
  "title": "RV-02 review: setup-python dependency update",
  "case_id": "RV-02",
  "reviewer_version": "1.0",
  "reviewer_hash": "d98d2797c73aaa71b6f2401541d4f7b3248dd033d141b639f48e95eaa5e9471b",
  "verdict": "APPROVE",
  "rationale": "The complete pinned diff changes only the setup action major version in CI and release workflows while retaining the declared Python version and workflow behavior. The supplied historical workflow validation is PASS and no manual, physical, migration, secret, or production-availability check is selected by the classification.",
  "classification": {
    "task_classes": ["infrastructure_deployment"],
    "risk_flags": [],
    "sp_fail_ids": []
  },
  "scope_architecture": "All four changed occurrences are the declared setup action version update. No runtime application ownership, service topology, data contract, or control path changes.",
  "findings": [],
  "contract_consumer_review": "The workflow consumers retain python-version 3.12; no application, edge, storage, API, MQTT, dashboard, export, or public contract changes are present.",
  "evidence_matrix": [
    {"check": "Approved fixture brief and pinned diff identity", "status": "PASS", "manual": false},
    {"check": "Historical CI workflow validation supplied in implementation report", "status": "PASS", "manual": false},
    {"check": "Manual/rehearsal evidence", "status": "PASS", "manual": true}
  ],
  "operations_safety_security_privacy": "The diff does not add credentials, network exposure, deployment operations, physical actions, or external export behavior.",
  "documentation_assessment": "No documentation changes are necessary for this isolated workflow dependency update.",
  "follow_ups": [],
  "limitations": ["The supplied historical workflow PASS was reviewed as evidence; the historical CI run was not re-executed.", "No production or external GitHub state was accessed."]
}
