{
  "schema": "senior-pomidor.review-report.v1",
  "title": "RV02: actions/setup-python update review",
  "case_id": "RV02",
  "reviewer_version": "1.0",
  "reviewer_hash": "51ab66ce62e2b5363d7a71587edb937f1e34feb842d726e24141da4b03c38f0f",
  "verdict": "APPROVE",
  "rationale": "The reviewed commit changes only actions/setup-python from v6 to v7 in the existing CI and release setup steps. The named action remains in place, no unrelated workflow behavior is changed in the patch, and the supplied historical dependency-update CI and workflow syntax validation passed.",
  "classification": {
    "task_classes": ["infrastructure_deployment"],
    "risk_flags": [],
    "sp_fail_ids": []
  },
  "scope_architecture": "The workflow dependency update is within the approved scope. It changes no application ownership boundary, runtime default, persisted field, environment variable, migration, or privilege boundary.",
  "findings": [],
  "contract_consumer_review": "No server, edge, API, MQTT, storage, dashboard, export, or public contract changes. The existing CI and release workflows remain the consumers of the updated action reference.",
  "evidence_matrix": [
    {
      "check": "historical dependency-update CI and workflow syntax validation",
      "status": "PASS",
      "manual": false
    }
  ],
  "operations_safety_security_privacy": "No production, physical, secret, migration, or external-export behavior is in scope; manual evidence is not applicable.",
  "documentation_assessment": "No documentation changes are required for this isolated workflow action-reference update.",
  "follow_ups": [],
  "limitations": [
    "Review was intentionally limited to the supplied commit, packet evidence, mandatory rules, reviewer instructions, and report schema.",
    "Upstream action release behavior was not independently evaluated."
  ]
}
