{
  "schema": "senior-pomidor.review-report.v1",
  "title": "Review of docker/setup-buildx-action v4 update",
  "case_id": "RV-04",
  "reviewer_version": "1.0",
  "reviewer_hash": "51ab66ce62e2b5363d7a71587edb937f1e34feb842d726e24141da4b03c38f0f",
  "verdict": "APPROVE",
  "rationale": "The historical diff updates only docker/setup-buildx-action from v3 to v4 in the release image-build job. The supplied validation evidence passes and no required manual verification applies.",
  "classification": {
    "task_classes": ["infrastructure_deployment"],
    "risk_flags": [],
    "sp_fail_ids": []
  },
  "scope_architecture": "The release workflow retains its existing QEMU setup, subsequent registry login, image build, platforms, and publish flow; only the Buildx setup action version changes, so server ownership and safety boundaries are unchanged.",
  "findings": [],
  "contract_consumer_review": "No application, edge, API, storage, or public contract changes. The workflow continues to configure the existing Buildx setup step before the existing image-build consumer.",
  "evidence_matrix": [
    {
      "check": "historical dependency-update CI and workflow syntax validation",
      "status": "PASS",
      "manual": false
    },
    {
      "check": "no production, physical, secret or migration behavior is in scope",
      "status": "NOT_RUN",
      "manual": true
    }
  ],
  "operations_safety_security_privacy": "The update leaves the existing workflow controls intact and does not alter production deployment, hardware access, secret handling, migration behavior, or external export.",
  "documentation_assessment": "No documentation change is required for this isolated dependency-version update.",
  "follow_ups": [],
  "limitations": ["Review is limited to historical dependency-update CI and workflow syntax evidence; no production or physical verification is applicable."]
}
